{"admission":"spec-only","assetRefs":[{"catalogEntryId":"workstation-basic-mask-0","familyRef":{"id":"workstation-basic","version":2},"frameRef":{"id":"mask-0","version":1},"lifecycleGroup":"workstations","variantId":"isolated"},{"catalogEntryId":"workstation-basic-mask-10","familyRef":{"id":"workstation-basic","version":2},"frameRef":{"id":"mask-10","version":1},"lifecycleGroup":"workstations","variantId":"middle"},{"catalogEntryId":"workstation-basic-mask-2","familyRef":{"id":"workstation-basic","version":2},"frameRef":{"id":"mask-2","version":1},"lifecycleGroup":"workstations","variantId":"east-end"},{"catalogEntryId":"workstation-basic-mask-8","familyRef":{"id":"workstation-basic","version":2},"frameRef":{"id":"mask-8","version":1},"lifecycleGroup":"workstations","variantId":"west-end"}],"bundleId":"ground-floor-office-v2","bundleVersion":1,"catalogRef":{"id":"office-assets-v2","version":1},"contextRecovery":{"failClosedOnError":true,"preserveSimulationHash":true,"rebuildResources":true,"renderLatestSnapshot":true},"floorRef":{"id":"ground-floor","version":1},"floorSwitch":{"preloadBeforeSwitch":true,"preserveWorldHash":true,"releaseAfterSwitch":true},"lifecycle":{"abortableLoad":true,"idempotentUnload":true,"preloadOrder":["workstation-basic-mask-0","workstation-basic-mask-10","workstation-basic-mask-2","workstation-basic-mask-8"],"referenceCounted":true,"unloadOrder":["workstation-basic-mask-8","workstation-basic-mask-2","workstation-basic-mask-10","workstation-basic-mask-0"],"uploadOrder":["workstation-basic-mask-0","workstation-basic-mask-10","workstation-basic-mask-2","workstation-basic-mask-8"]},"missingAssetPolicy":"fail-closed","schemaVersion":"office-scene-bundle-v1"}